{
  "slug": "wealth-management",
  "title": "Wealth Management",
  "kind": "role",
  "build_order": 6,
  "zones": [
    {
      "zone": 1,
      "title": "The Wealth Management Ecosystem",
      "front_door": "Z1.1"
    },
    {
      "zone": 2,
      "title": "Types of Wealth Management (Strategy & Service Branches)",
      "front_door": "Z2.1"
    },
    {
      "zone": 3,
      "title": "The Wealth Management Process (from the Household's Seat)",
      "front_door": "Z3.1"
    },
    {
      "zone": 4,
      "title": "Managing the Household Over a Life (the Ongoing Relationship)",
      "front_door": "Z4.1"
    },
    {
      "zone": 5,
      "title": "The Firm & the Client",
      "front_door": "Z5.1"
    }
  ],
  "sources": [],
  "derived": {
    "globals_contributed": 23,
    "global_range": "G159–G181",
    "zone_node_count": 35,
    "globals_reused": [
      "G7",
      "G8",
      "G9",
      "G29",
      "G56",
      "G57",
      "G102",
      "G111",
      "G116",
      "G124",
      "G127",
      "G137",
      "G138",
      "G139",
      "G143",
      "G144",
      "G145",
      "G146",
      "G147",
      "G148",
      "G150",
      "G151",
      "G152",
      "G153",
      "G154",
      "G155",
      "G156",
      "G157",
      "G158"
    ],
    "gap_count": 22
  },
  "status": "mapped"
}
