{
  "slug": "sector-energy",
  "title": "Energy (Sector)",
  "kind": "sector-layer1",
  "build_order": 14,
  "visibility": "active",
  "status": "mapped",
  "zones": [
    {
      "zone": 1,
      "title": "Powering Everything, Pricing Nothing",
      "front_door": "Z1.1"
    },
    {
      "zone": 2,
      "title": "Four Businesses Along One Barrel's Journey",
      "front_door": "Z2.1"
    },
    {
      "zone": 3,
      "title": "The Price, the Cycle & the Cartel",
      "front_door": "Z3.1"
    },
    {
      "zone": 4,
      "title": "Going Deeper: Analyzing One",
      "front_door": "Z4.1"
    },
    {
      "zone": 5,
      "title": "The State, the Sunset & the New Map",
      "front_door": "Z5.1"
    }
  ],
  "sources": [],
  "derived": {
    "globals_contributed": 10,
    "global_range": "G304–G313",
    "zone_node_count": 13,
    "globals_reused": [
      "G7",
      "G20",
      "G24",
      "G25",
      "G26",
      "G27",
      "G42",
      "G53",
      "G64",
      "G70",
      "G87",
      "G88",
      "G89",
      "G90",
      "G91",
      "G92",
      "G93",
      "G94",
      "G95",
      "G102",
      "G103",
      "G127",
      "G137",
      "G138",
      "G140",
      "G149",
      "G191",
      "G195",
      "G209",
      "G216",
      "G223",
      "G225",
      "G232",
      "G235",
      "G237",
      "G252",
      "G253",
      "G255",
      "G259",
      "G277",
      "G286",
      "G293"
    ],
    "gap_count": 3
  }
}
