{
  "slug": "sector-information-technology",
  "title": "Information Technology (Sector)",
  "kind": "sector-layer1",
  "build_order": 13,
  "visibility": "active",
  "status": "mapped",
  "zones": [
    {
      "zone": 1,
      "title": "Code Eats the World",
      "front_door": "Z1.1"
    },
    {
      "zone": 2,
      "title": "Three Businesses, One Ticker Prefix",
      "front_door": "Z2.1"
    },
    {
      "zone": 3,
      "title": "Networks, Lock-In & the Scoreboard",
      "front_door": "Z3.1"
    },
    {
      "zone": 4,
      "title": "Going Deeper: Analyzing One",
      "front_door": "Z4.1"
    },
    {
      "zone": 5,
      "title": "Gravity, Regulators & the Next Wave",
      "front_door": "Z5.1"
    }
  ],
  "sources": [],
  "derived": {
    "globals_contributed": 11,
    "global_range": "G293–G303",
    "zone_node_count": 11,
    "globals_reused": [
      "G27",
      "G28",
      "G29",
      "G34",
      "G42",
      "G53",
      "G67",
      "G74",
      "G87",
      "G88",
      "G90",
      "G92",
      "G102",
      "G127",
      "G132",
      "G137",
      "G138",
      "G140",
      "G149",
      "G183",
      "G184",
      "G192",
      "G193",
      "G201",
      "G215",
      "G216",
      "G237",
      "G259",
      "G274",
      "G275",
      "G276",
      "G277"
    ],
    "gap_count": 2
  }
}
