{
  "slug": "corporate-finance",
  "title": "Corporate Finance",
  "kind": "core-concept",
  "build_order": 999,
  "visibility": "draft",
  "status": "in-progress",
  "zones": [
    { "zone": 1, "title": "PLACEHOLDER — Concept zone 1", "front_door": "Z1.1" },
    { "zone": 2, "title": "PLACEHOLDER — Concept zone 2", "front_door": "Z2.1" },
    { "zone": 3, "title": "PLACEHOLDER — Concept zone 3", "front_door": "Z3.1" },
    { "zone": 4, "title": "PLACEHOLDER — Concept zone 4", "front_door": "Z4.1" },
    { "zone": 5, "title": "PLACEHOLDER — Concept zone 5", "front_door": "Z5.1" }
  ],
  "sources": []
}
